{
  "$comment": "Structural validation only. Implement backend-contract validateAnnotationsFileSemantics after this schema: every planeNormal must be nonzero, and every nonempty labelName must be declared in its own tool-kind label namespace.",
  "$schema": "https://json-schema.org/draft/2020-12/schema",
  "type": "object",
  "properties": {
    "schemaVersion": {
      "type": "number",
      "const": 1
    },
    "space": {
      "type": "string",
      "const": "LPS"
    },
    "labels": {
      "type": "object",
      "properties": {
        "rulers": {
          "type": "object",
          "propertyNames": {
            "type": "string",
            "pattern": "^(?!__proto__$)"
          },
          "additionalProperties": {
            "type": "object",
            "properties": {
              "color": {
                "description": "A hex color such as `#d60000` or a CSS color keyword such as `lime`. It styles only a segment the label creates: a label whose name the client already holds keeps that segment's color and stroke width. Any other syntax, including functional forms such as `rgb()` and `hsl()`, is ignored and reported to the user, and a new segment then takes an automatic color.",
                "type": "string"
              },
              "strokeWidth": {
                "type": "number"
              },
              "fillColor": {
                "description": "Accepted so an existing producer keeps validating, and ignored on labels.",
                "type": "string"
              }
            },
            "additionalProperties": false
          }
        },
        "rectangles": {
          "type": "object",
          "propertyNames": {
            "type": "string",
            "pattern": "^(?!__proto__$)"
          },
          "additionalProperties": {
            "type": "object",
            "properties": {
              "color": {
                "description": "A hex color such as `#d60000` or a CSS color keyword such as `lime`. It styles only a segment the label creates: a label whose name the client already holds keeps that segment's color and stroke width. Any other syntax, including functional forms such as `rgb()` and `hsl()`, is ignored and reported to the user, and a new segment then takes an automatic color.",
                "type": "string"
              },
              "strokeWidth": {
                "type": "number"
              },
              "fillColor": {
                "description": "Accepted so an existing producer keeps validating, and ignored on labels.",
                "type": "string"
              }
            },
            "additionalProperties": false
          }
        },
        "polygons": {
          "type": "object",
          "propertyNames": {
            "type": "string",
            "pattern": "^(?!__proto__$)"
          },
          "additionalProperties": {
            "type": "object",
            "properties": {
              "color": {
                "description": "A hex color such as `#d60000` or a CSS color keyword such as `lime`. It styles only a segment the label creates: a label whose name the client already holds keeps that segment's color and stroke width. Any other syntax, including functional forms such as `rgb()` and `hsl()`, is ignored and reported to the user, and a new segment then takes an automatic color.",
                "type": "string"
              },
              "strokeWidth": {
                "type": "number"
              },
              "fillColor": {
                "description": "Accepted so an existing producer keeps validating, and ignored on labels.",
                "type": "string"
              }
            },
            "additionalProperties": false
          }
        }
      },
      "additionalProperties": false
    },
    "tools": {
      "type": "object",
      "properties": {
        "rulers": {
          "type": "array",
          "items": {
            "type": "object",
            "properties": {
              "firstPoint": {
                "minItems": 3,
                "maxItems": 3,
                "type": "array",
                "prefixItems": [
                  {
                    "type": "number"
                  },
                  {
                    "type": "number"
                  },
                  {
                    "type": "number"
                  }
                ]
              },
              "secondPoint": {
                "minItems": 3,
                "maxItems": 3,
                "type": "array",
                "prefixItems": [
                  {
                    "type": "number"
                  },
                  {
                    "type": "number"
                  },
                  {
                    "type": "number"
                  }
                ]
              },
              "frameOfReference": {
                "type": "object",
                "properties": {
                  "planeNormal": {
                    "minItems": 3,
                    "maxItems": 3,
                    "type": "array",
                    "prefixItems": [
                      {
                        "type": "number"
                      },
                      {
                        "type": "number"
                      },
                      {
                        "type": "number"
                      }
                    ]
                  },
                  "planeOrigin": {
                    "minItems": 3,
                    "maxItems": 3,
                    "type": "array",
                    "prefixItems": [
                      {
                        "type": "number"
                      },
                      {
                        "type": "number"
                      },
                      {
                        "type": "number"
                      }
                    ]
                  }
                },
                "required": [
                  "planeNormal",
                  "planeOrigin"
                ],
                "additionalProperties": false
              },
              "slice": {
                "type": "number"
              },
              "frame": {
                "type": "integer",
                "minimum": 0,
                "maximum": 9007199254740991
              },
              "labelName": {
                "type": "string"
              },
              "name": {
                "type": "string"
              },
              "metadata": {
                "type": "object",
                "propertyNames": {
                  "type": "string",
                  "pattern": "^(?!__proto__$)"
                },
                "additionalProperties": {
                  "type": "string"
                }
              }
            },
            "required": [
              "firstPoint",
              "secondPoint",
              "frameOfReference"
            ],
            "additionalProperties": false
          }
        },
        "rectangles": {
          "type": "array",
          "items": {
            "type": "object",
            "properties": {
              "firstPoint": {
                "minItems": 3,
                "maxItems": 3,
                "type": "array",
                "prefixItems": [
                  {
                    "type": "number"
                  },
                  {
                    "type": "number"
                  },
                  {
                    "type": "number"
                  }
                ]
              },
              "secondPoint": {
                "minItems": 3,
                "maxItems": 3,
                "type": "array",
                "prefixItems": [
                  {
                    "type": "number"
                  },
                  {
                    "type": "number"
                  },
                  {
                    "type": "number"
                  }
                ]
              },
              "frameOfReference": {
                "type": "object",
                "properties": {
                  "planeNormal": {
                    "minItems": 3,
                    "maxItems": 3,
                    "type": "array",
                    "prefixItems": [
                      {
                        "type": "number"
                      },
                      {
                        "type": "number"
                      },
                      {
                        "type": "number"
                      }
                    ]
                  },
                  "planeOrigin": {
                    "minItems": 3,
                    "maxItems": 3,
                    "type": "array",
                    "prefixItems": [
                      {
                        "type": "number"
                      },
                      {
                        "type": "number"
                      },
                      {
                        "type": "number"
                      }
                    ]
                  }
                },
                "required": [
                  "planeNormal",
                  "planeOrigin"
                ],
                "additionalProperties": false
              },
              "slice": {
                "type": "number"
              },
              "frame": {
                "type": "integer",
                "minimum": 0,
                "maximum": 9007199254740991
              },
              "labelName": {
                "type": "string"
              },
              "name": {
                "type": "string"
              },
              "metadata": {
                "type": "object",
                "propertyNames": {
                  "type": "string",
                  "pattern": "^(?!__proto__$)"
                },
                "additionalProperties": {
                  "type": "string"
                }
              }
            },
            "required": [
              "firstPoint",
              "secondPoint",
              "frameOfReference"
            ],
            "additionalProperties": false
          }
        },
        "polygons": {
          "type": "array",
          "items": {
            "type": "object",
            "properties": {
              "points": {
                "minItems": 3,
                "type": "array",
                "items": {
                  "minItems": 3,
                  "maxItems": 3,
                  "type": "array",
                  "prefixItems": [
                    {
                      "type": "number"
                    },
                    {
                      "type": "number"
                    },
                    {
                      "type": "number"
                    }
                  ]
                }
              },
              "frameOfReference": {
                "type": "object",
                "properties": {
                  "planeNormal": {
                    "minItems": 3,
                    "maxItems": 3,
                    "type": "array",
                    "prefixItems": [
                      {
                        "type": "number"
                      },
                      {
                        "type": "number"
                      },
                      {
                        "type": "number"
                      }
                    ]
                  },
                  "planeOrigin": {
                    "minItems": 3,
                    "maxItems": 3,
                    "type": "array",
                    "prefixItems": [
                      {
                        "type": "number"
                      },
                      {
                        "type": "number"
                      },
                      {
                        "type": "number"
                      }
                    ]
                  }
                },
                "required": [
                  "planeNormal",
                  "planeOrigin"
                ],
                "additionalProperties": false
              },
              "slice": {
                "type": "number"
              },
              "frame": {
                "type": "integer",
                "minimum": 0,
                "maximum": 9007199254740991
              },
              "labelName": {
                "type": "string"
              },
              "name": {
                "type": "string"
              },
              "metadata": {
                "type": "object",
                "propertyNames": {
                  "type": "string",
                  "pattern": "^(?!__proto__$)"
                },
                "additionalProperties": {
                  "type": "string"
                }
              }
            },
            "required": [
              "points",
              "frameOfReference"
            ],
            "additionalProperties": false
          }
        }
      },
      "additionalProperties": false
    }
  },
  "required": [
    "schemaVersion",
    "space",
    "tools"
  ],
  "additionalProperties": {}
}
